source_id,item,search_or_vendor_hint,source_status,provenance,verification_needed,next_action,notes
SRC-001,donor free reeds,"used melodica, harmonica, accordion repair reeds, sheng replacement reeds",live_stock_transient,search terms only,"price; availability; reed dimensions; material; returnability","verify current listing before purchase","No specific vendor claim is current"
SRC-002,replacement reed stock,"accordion/harmonica repair supplier free reeds",supplier_spec_unverified,supplier category,"pitch label; reed plate dimensions; material; minimum order","request measurements or buy small sample","Treat pitch labels as unverified"
SRC-003,reed blank sheet,"0.1-0.3 mm brass or phosphor bronze shim stock",supplier_spec_unverified,material category,"exact thickness; alloy; temper; burr behavior","select only after coupon fabrication method is chosen","Handmade reeds require separate setup skill"
SRC-004,windchest sheet material,"clear acrylic, Baltic birch plywood, or hardwood offcut",substitution_candidate,shop material category,"flatness; machinability; seal compatibility","choose a serviceable test material","Transparent material helps leak inspection"
SRC-005,gasket material,"cork gasket sheet, silicone sheet, urethane foam",supplier_spec_unverified,material category,"compression set; thickness; air leakage","test with coupon chamber","Gasket performance can dominate onset behavior"
SRC-006,test pipes,"brass tube, bamboo, hardwood bore, printed test tube",substitution_candidate,material category,"inside diameter; wall thickness; straightness; end finish","pick after reed pitch is measured","Pipe choice is a test variable, not final design"
SRC-007,pressure measurement,"U-tube manometer, low-range differential pressure sensor",needs_supplier_quote,tool category,"range; calibration; units; sampling method","borrow or source before onset-pressure gate","Record pressure in pascals"
SRC-008,pitch measurement,"calibrated tuner, FFT app, audio interface",substitution_candidate,tool category,"A4 reference; sample rate; noise floor","verify against known reference before logging","Record measurement environment"
